Affiliation No.,Name,Head/Principle,Status of the School:,Affiliated Upto,Address,Phone,Email
2730049,RAMJAS SCHOOL,MOHINI BINDRA,Senior Secondary, 31/03/2023 ,"PUSA ROAD NEW DELHI,110005","011,25767358",mohinibindra@hotmail.com
2778037,ramjas sec school no-6,SHYAM PAL BHARTI,Secondary School, 31/03/2020 ,"bazar sita ram delhi,110006","011,23234557",shyampalbharti@gmail.com
2778044,RAMJAS SR SEC SCHOOL NO-1,RAJESH SANSANWAL,Senior Secondary, 31/03/2017 ,"DARYAGANJ NEW DELHI,110002","011,23274640",ramjasnumber1@gmail.com
2778052,RAMJAS SR SEC SCHOOL NO-2,CHANDI PRASAD KOTHIYAL,Senior Secondary, 31/03/2024 ,"ANAND PARBAT NEW DELHI,110005","011,28762806",kothiyalcp23@gmail.com
2778058,RAMJAS SR SEC SCHOOL NO-3,Anil Kumar Gautam,Senior Secondary, 31/03/2020 ,"KUCHA NATWAN CHANDNI CHOWK DELHI,110006","011,23961334",anilgautam.gautam11@gmail.com
2778025,ramjas sr sec school no-4,VIPIN KUMAR,Senior Secondary, 31/03/2020 ,"chitragupta road new delhi,110055","011,23525070",kumarvipinpatni@gmail.com
2778053,ramjas sr sec school no-5,SANDEEP GUPTA,Senior Secondary, 31/03/2022 ,"karol bagh new delhi,110005","011,28722815",ramjas5@rediffmail.com
2730784,RAN SINGH MODEL PUBLIC SCHOOL,Mrs.Ved Kaur,Secondary School, 31/03/2020 ,"Pratap Vihar, Part - III, E - Block, Kirari, New Delhi - 110086,110086",",9811194517",nkmahajanfca@gmail.com
2758038,rana partap sindhi govt. sarvodaya,Prem Sukh,Senior Secondary, 31/03/2020 ,"co-edu sr. sec.school new rajinder nagar new delhi,110060","011,28741585",premsukh1958@gmail.com
2760004,RANI CHENNAMMA GOVT GIRLS SR SEC SCHOOL,ANITA BHARTI,Senior Secondary, 31/03/2025 ,"D BLOCK JAHANGIR PURI DELHI,110033","011,27635501",anita.bharti@gmail.com
2778068,rani dutta arya vidyalaya,Sita Sharma,Senior Secondary, 31/03/2016 ,"1488 pataudi house darya ganj new delhi,110002","011,23253943",seetasharma715@gmail.com
2764003,rani jhansi govt sarvodaya girls sr,Manisha Vaish,Senior Secondary, 31/03/2020 ,"sec school railway colony tughlakabad new delhi,110044","011,26369589",rjskv.tkd@gmail.com
2730700,Rani Public School,GEETA SAINI,Secondary School, 31/03/2020 ,"16/10, A-1 Block, Sant Nagar, Burari, Delhi,110084","011,27615830",saigeetasaini@gmail.com
2730738,RAO BALRAM PUBLIC SCHOOL,KOKINDRA BAI,Secondary School, 31/03/2023 ,"SARASWATI ENCLAVE GOPAL NAGAR NAJAFGARH NEW DELHI,110043","011,28015298",RBPSDELHI43@GMAIL.COM
2730800,RAO CONVENT SCHOOL,Mrs.PROMILA,Secondary School, 31/03/2021 ,"VILL PANDWALA KHURD, NAJAFGARH, NEW DELHI -110043,110043",",09968098055",vikrantyadav000005@gmai.comWebsite:http://www.raoconventschool.co.in
2730682,RAO GANGA RAM PUBLIC SCHOOL,NIKKI YADAV,Senior Secondary, 31/03/2022 ,"OLD DELHI GURGOAN ROAD, KAPASHERA, NEW DELHI 110037,110037","011,25064697",nikkirgryadav@gmail.com
2730167,RAO MAN SINGH SR SEC SCHOOL,JAI KRISHAN ARORA,Senior Secondary, 31/03/2020 ,"ROSHAN PURA  PAPRAWAT ROAD NAJAFGARH NEW DELHI,110043","011,25010922",raomansinghschool1989@gmail.com
2730318,RAO MOHAR SINGH MEMORIAL PUB SCHOOL,PARKASH DEVI SHARMA,Senior Secondary, 31/03/2021 ,"ROSHANPURA PAPRAWAT ROAD NAJAFGARH, DISTT SOUTH WEST DELHI, NEW DELHI,250342","011,65478269",info@raomoharsinghschool.com
2756015,rao tula ram govt.  sarvodaya co.ed,kanhya lal,Senior Secondary, 31/03/2018 ,"sr sec school surera new delhi,110043","011,25012070",narenkr@eth.net
2730230,RASHTRA SHAKTI VIDYALAYA,SHASHI TYAGI,Senior Secondary, 31/03/2020 ,"HASTSAL (GANDHI NIDHI) NEAR UTTAM NAGAR NEW DELHI,110059","011,25083637",RSVPRSHASHI.09@GMAIL.COM
2786004,RASHTRIYA VIRJA NAND ANDH KANYA SR.,SMT. USHA KIRAN,Senior Secondary, 31/03/2018 ,"SEC.SCHOOL J-BLOCK VIKAS PURI NEW DELHI,110018",",25507758",
2730685,ratan jee modern school,mrs.anita devi,Senior Secondary, 31/03/2021 ,"tanki road., shakti vihar, badarpur, new delhi - 110044,110044",",09810074551",nkmahajanfca@gmail.com
2782003,rattan devi arya girls sr sec school,PRAVEEN KUMARI,Senior Secondary, 31/03/2021 ,"krishna nagar delhi,110051","011,22093483",rdagsss@gmail.com
2730105,RAVINDRA PUBLIC SCHOOL,VIJAY BHAT,Senior Secondary, 31/03/2020 ,"SD BLOCK (NEAR T V TOWER) PITAMPURA, DISTT SOUTH WEST DELHI, DELHI,110088","011,27312598",ravindrapublicschool@rediffmail.com
2778064,RAWALPINDI S D SR SEC SCHOOL,SHRI D K NARANG,Senior Secondary, 31/03/2022 ,"SUBZI MANDI DELHI,110007","011,23856716",
2730335,RED ROSE MODEL SCHOOL,ALKA AGGARWAL,Secondary School, 31/03/2020 ,"WE BLOCK MOHAN GARDEN NEW DELHI,110059","011,25351178",redrose132@hotmail.com
2730194,RED ROSES PUBLIC SCHOOL,ANURADHA MEHTA,Senior Secondary, 31/03/2020 ,"D BLOCK  SAKET NEW DELHI,110017","011,26962977",anuradha210205@gmail.comWebsite:www.redrosesaket.com
2730143,REMAL PUBLIC SCHOOL,SANGEETA VERMA,Senior Secondary, 31/03/2022 ,"BLOCK-A POCKET-2 SECTOR III ROHINI DELHI,110085","011,47512024",remalps@yahoo.com
2730266,RICH HARVEST PUBLIC SCHOOL,NEHA GANDHI,Senior Secondary, 31/03/2020 ,"A/1/253 JANAKPURI, DISTT WEST DELHI, NEW DELHI,110058","011,25619922",nehagandhivij@yahoo.com
2730588,RICHMONDD GLOBAL SCHOOL,KIRAN SEHAJPAL,Senior Secondary, 31/03/2016 ,"NS RD, OPP INDER ENCLAVE, MIANWALI NAGAR, PASHIM VIHAR,110087","011,25276588",kiransehajpal@rediffmail.comWebsite:www.richmonddglobalschool.edu.in
2730388,ring midways public school,mr. rizak ram gaur,Senior Secondary, 31/03/2019 ,"najafgarh vipin garden, DISTT SOUTH WEST DELHI, new delhi,110059","011,25351710",shashisms@gmail.com
2730377,RISHABH PUBLIC SCHOOL,LATA SINGH,Senior Secondary, 31/03/2021 ,"POCKET IV MAYUR VIHAR PHASE I DELHI,110091","011,22752055",rishabhpublicschool@yahoo.co.in
2730649,RISHIKUL VIDYAPEETH,Alka Datt,Senior Secondary, 31/03/2021 ,"Alipur Delhi-36,110036","011,65709800",rishikulvidyapeeth36@gmail.comWebsite:http://www.therishikul.edu.in
2730409,RISING STAR ACADEMY PUBLIC SCHOOL,SHASHI HARISH,Senior Secondary, 31/03/2020 ,"110 RAJ NAGAR PITAM PURA DELHI,110034","011,45231150",pradeep.harish27@yahoo.com
2730799,ROCKFIELD PUBLIC SCHOOL,MRS. ALKA SRIVASTAVA,Senior Secondary, 31/03/2021 ,"BLOCK-A, SECTOR-16, ROHINI, DELHI,110089",",01127856800",info@rockfieldschool.netWebsite:http://www.rockfieldschool.net
2778011,ROHTAGI A V SR SEC SCHOOL,MANJU TYAGI,Senior Secondary, 31/03/2020 ,"NAI SARAK DELHI,110006","011,23265625",MANJUTYAGI11@REDIFFMAIL.COM
2730071,ROSARY SR SEC SCHOOL,REV FR VINCENT DSOUZA,Senior Secondary, 31/03/2020 ,"KINGSWAY CAMP RADIO COLONY DELHI,110009","011,27606359",school_rosary@rediffmail.comWebsite:http://rosaryschool.in
2730426,ROSE VALLEY PUBLIC SCHOOL,Mr. MS KAVITA,Secondary School, 31/03/2007 ,"RZ 20 NATHAN VIHAR NANGLOI NAJAFGARH ROAD NEW DELHI,      ","011,28365532",rosevalleypublicschool@yahoo.co.in
2762030,ROSHANARA GOVT.SARVODAYA GIRLS S.S.S,MADHU KUMAR,Senior Secondary, 31/03/2020 ,"NO.1 MANSAROVAR PARK SHAHDARA DELHI,110032","011,22123865",KUMARMADHU1966@GMAIL.COM
2730806,Royal International School,Mrs.Rajni Devi,Secondary School, 31/03/2021 ,"Kotla Vihar, Phase - II, Baprola,,110043","011,9899108506, 8468092788",nkmahajanfca@gmail.com
2730100,RUKMANI DEVI JAIPURIA PUBLIC SCHOOL,S K SAXENA,Senior Secondary, 31/03/2020 ,"23 RAJPUR ROAD, DISTT NORTH DELHI, DELHI,110054","011,23965643",sksaxena20012@gmail.com
2730165,RUKMANI DEVI PUBLIC SCHOOL,Anjali Kotnala,Senior Secondary, 31/03/2019 ,"CD BLOCK PITAMPURA, DISTT NORHT WEST DELHI, DELHI,110034","011,27314235",anjali.kotnala@rdpschool.edu.in
2730373,RURAL COMPLEX FOR COMPELTE EDUCATION,RAJINDER KUMAR SAINI,Secondary School, 31/03/2021 ,"RCCE PUBLIC SCHOOL V PO CHANDANHULLA MEHRAULI, NEW DELHI,110030","011,64741464",rajindersaini1965@gmail.com
2730310,RYAN INTERNATIONAL,Mamta Nanda,Senior Secondary, 31/03/2022 ,"SECTOR 25 PHASE III ROHINI, NORTH WEST DELHI, DELHI,110085","011,27932770",mamtananda71@gmail.com
2730355,RYAN INTERNATIONAL SCHOOL,SULOCHANA RAJA,Senior Secondary, 31/03/2022 ,"SECTOR B KONDLI GHAROLI MAYUR VIHAR PHASE III, DISTT EAST DELHI, DELHI,110096","011,22612036",sulochana.raja@ryangroup.org
2730239,RYAN INTERNATIONAL SCHOOL,Mr. Arti Bahadur,Senior Secondary, 31/03/2020 ,"C-8 VASANT KUNJ, DISTT SOUTH DELHI, NEW DELHI,110070","011,26899089",ris.vasantkunj@ryangroup.org
2776008,s b mills sr sec school,PREETI SHUKLA,Senior Secondary, 31/03/2022 ,"shivaji marg new delhi,110015","011,25101237",principalsbmshivajimarg@gmail.com
2776002,s d co-ed sec school,sh r p jain,Secondary School, 31/03/2022 ,"sadar bazar delhi cantt new delhi,110010",",",
2786002,S D GIRLS SR SEC SCHOOL,NEERJA SHARMA,Senior Secondary, 31/03/2022 ,"EAST PATEL NAGAR NEW DELHI,110008","011,25886117",neerja.akinchan@gmail.com
2788018,s d hari mandir girls  sr sec school,ANITA JAIN,Senior Secondary, 31/03/2018 ,"jhandewalan marg nabi karim new delhi,110055","011,23525136",jainanita102@yahoo.com
2730111,S D PUBLIC SCHOOL,SUMAN GANDHI,Senior Secondary, 31/03/2020 ,"ROAD NO 10 EAST PUNJABI BAGH NEW DELHI,110026","011,28311317",sanatandps@gmail.comWebsite:www.ggnpublicschool.com
2730217,S D PUBLIC SCHOOL,MEENAKSHI GUPTA,Senior Secondary, 31/03/2020 ,"LAL MANDIR EAST PATEL NAGAR, DISTT WEST DELHI, NEW DELHI,110008","011,25889160",mnksh_gpt@yahoo.co.inWebsite:www.mountabuschool.com
2730236,S D PUBLIC SCHOOL,ANJALI MAGOO,Secondary School, 31/03/2021 ,"NEAR POLICE STATION KIRTI NAGAR NEW DELHI,110015","011,25930153",anjalimagoo@gmail.com
2776009,s d sec school (gujarati),RAKESH BABU,Secondary School, 31/03/2020 ,"kirti nagar new delhi,110015","011,65484729",rbstyarthi@gmail.com
2772005,s d sr sec school,DHARAMVEER,Senior Secondary, 31/03/2021 ,"shahdara delhi,110032","011,22303340",schoolsd@ymail.com
2774008,s e s baba nebhraj sr sec sch,POONAM BHATNAGAR,Senior Secondary, 31/03/2024 ,"lajpat nagar i new delhi,110024","011,29816006",sesbabanebhraj@yahoo.co.in
2788024,S G H K KHALSA GIRLS SR SEC SCHOOL,SURINDER KAUR BAWA,Senior Secondary, 31/03/2020 ,"MATA SUNDARI,MATA SUNDARI ROAD NEW DELHI,110002","011,23210106",MATASUNDRI1956@GMAIL.COM
2778019,s g t b girls sr sec school,Rashmi Bhatnagar,Senior Secondary, 31/03/2021 ,"pul bangash delhi,110006","011,23527050",sgtbpulbangash@gmail.com
2788033,S G T B KHALSA GIRLS SR SEC,SUMAN MALA,Senior Secondary, 31/03/2020 ,"SCHOOL DEV NAGAR NEW DELHI,110005","011,28728480",sgtbkgd1953@gmail.com
2788014,s g t b khalsa girls sr sec school,DURGESH,Senior Secondary, 31/03/2023 ,"sis ganj chandni chowk delhi,110006","011,23275936",principalsgtb@gmail.com
2774017,s g t b khalsa girls sr sec school,AJIT KAUR,Senior Secondary, 31/03/2020 ,"ali ganj lodhi colony new delhi,110003","011,24617802",sgtbaliganj@gmail.com
2752130,s k v,SEEMA KHURANA,Senior Secondary, 31/03/2022 ,"khicharipur village, j j colony, delhi-110091,110091","011,22786916",1002360hos@gmail.com
2750016,S K V,RAKESH BAL,Senior Secondary, 31/03/2023 ,"TIKRI KHURD DELHI,110040","011,27786335",tikrikhurd@gmail.com
2730059,S M ARYA PUBLIC SCHOOL,Anjali Kohli,Senior Secondary, 31/03/2020 ,"ROAD NO 45 PUNJABI BAGH, DISTT WEST DELHI, NEW DELHI,110026","011,25221604",anjali.kohli@yahoo.com
2778062,S M JAIN MODERN SR SEC SCHOOL,VEENA MADAN,Senior Secondary, 31/03/2020 ,"BI - BLOCK, SHALIMAR BAGH, DELHI,110088","011,27481024",SMJAINSCHOOL@REDIFFMAIL.COM
2774005,S R S D SR SEC SCHOOL,J L CHAUHAN,Senior Secondary, 31/03/2025 ,"LAJPAT NAGAR IV NEW DELHI,110024","011,26475177",chauhanjl@rediffmail.comWebsite:alokbhartischool@yahoo.co
2788026,S S K KHALSA GIRLS SR SEC SCHOOL,MALTI HARIT,Senior Secondary, 31/03/2022 ,"DARYA GANJ NEW DELHI,110002","011,23274205",SSKKGSSS@GMAIL.COM
2774006,s s khalsa sr sec school (chakwal),PreetMohinder Singh  HOS,Senior Secondary, 31/03/2023 ,"lajpat nagar iv new delhi,110024","01,26417910",SSKhalsa.58@rediff.com
2778001,s s l t gujarat sr sec school,ARTI SHARMA,Senior Secondary, 31/03/2020 ,"raj niwas marg delhi,110054","011,23968357",artikrishan@yahoo.co.in
2730074,S S MOTA SINGH SR SEC MODEL SCHOOL,JYOTI AURORA,Senior Secondary, 31/03/2020 ,"BLOCK A JANAK PURI NEW DELHI,110058","011,25553198",JYOTI.SSMS@GMAIL.COM
2730568,S. D. SARSWATI BALMANDIR,VEENA SHARMA,Secondary School, 31/03/2021 ,"C-5, RAJIV NAGAR PHASE-II, Near Rohini, South West DELHI,110041","011,27582050",sdsarswati@gmail.com
2758047,S.B.V,RANDHIR SINGH,Senior Secondary, 31/03/2020 ,"O Block Mangol Puri Delhi-110 083,110083","011,27911573",RANDHIRSINGHMAHOUR@GMAIL.COM
2730723,S.G.N. Public School,Raj kumar,Secondary School, 31/03/2022 ,"H - 243, Kunwar Singh Nagar, Nangloi, Delhi - 110041,110041","011,28362813",rkumarprincipal@gmail.com
2730650,S.K.R. PUBLIC SCHOOL,UMA DWIVEDI,Senior Secondary, 31/03/2020 ,"BOHRIANWALA THALLA, INDER PURI, SOUTH WEST DELHI,110012","011,25835243",umadwivedi1@gmail.com
2730210,S.S.MOTA SINGH MODEL SCHOOL,ASHU MEHTA VP,Senior Secondary, 31/03/2020 ,"GURU HARKRISHAN NAGAR, DISTT WEST DELHI, NEW DELHI,110087","011,25285610",ashu.ssms@gmail.com
2730740,Saarthi International School,MRS. SANGEETA,Senior Secondary, 31/03/2022 ,"BEGUMPUR EXTN. (PANSALI ROAD OPP. SEC-32 ROHINI) NEAR HANUMAN CHOWK, VILLAGE BEGUMPUR,110086","011,64631046,9811801046",anilsdgpublicschool@gmail.com
2730615,Sachdeva Global School,SUMANA DUTTA SARKAR,Senior Secondary, 31/08/2020 ,"Sector-18-A, Dwarka, Phase-II, New Delhi-110075,110075","011,28032828",SUMANA@SACHDEVAGLOBAL.INWebsite:http://www.royalpresidencyschool.org
2730241,SACHDEVA PUBLIC SCHOOL,RAVIJA PRAKASH,Senior Secondary, 31/03/2020 ,"SECTOR 13 ROHINI DELHI,110085","011,27566176",info@spsrohini.com
2730124,SACHDEVA PUBLIC SCHOOL,MONA RASTOGI,Senior Secondary, 31/03/2020 ,"FP BLOCK MAURYA ENCLAVE PITAMPURA DELHI,110034","011,27322252",info@sachdevapublicschool.org
2730150,SADHU VASWANI INT. SCHOOL FOR GIRLS,Neeta Rastogi,Senior Secondary, 31/03/2023 ,"2ND STREET SHANTI NIKETAN NEW DELHI,110021","011,24110242",rastogineeta@rediffmail.com
2730101,SAHODAY SR. SEC. SCHOOL,SR SUDHA,Senior Secondary, 31/03/2023 ,"C-1 SAFDARJANG DEVE AREA, DISTT SOUTH DELHI, NEW DELHI,110016","011,26512344",sudhadevasia@gmail.com
2730307,SAI MEMORIAL,DR MRS MEENAKSHI KESWANI,Senior Secondary, 31/03/2022 ,"SAI BHAWAN F.C.CENTRE GEETA COLONY, DISTT EAST DELHI, DELHI,110031","011,22016866",meenakshikes@yahoo.co.in
2778049,salwan boys sr sec school,SAROJ ACHRA,Senior Secondary, 31/03/2021 ,"rajinder nagar new delhi,110060","011,45093219",principal.sbs@salwanschools.com
2788030,SALWAN GIRLS SR SEC SCHOOL,ALKA SIBBAL,Senior Secondary, 31/03/2020 ,"RAJINDER NAGAR NEW DELHI,110060","011,25782530",principal.sgs@salwanschools.com
2730401,SALWAN PUBLIC SCHOOL,KIRAN MEHTA,Senior Secondary, 31/03/2020 ,"KONDLI GHAROLI COMPLEX MAYUR VIHAR PHASE III, DISTT EAST DELHI, DELHI,110096","011,65092224",salwan.mv@gmail.com
2730048,SALWAN PUBLIC SCHOOL,INDU KHETARPAL,Senior Secondary, 31/03/2020 ,"RAJINDER NAGAR NEW DELHI,110060","011,49254500",principal.sps@salwanschools.comWebsite:http://www.salwanpublics
2730527,SAM INTERNATIONAL SCHOOL,RITU KHATI,Senior Secondary, 31/03/2017 ,"SECTOR 12, PHASE II DWARKA, DISTT SOUTH WEST DELHI, NEW DELHI,110075","011,42815282",sam_dwarka@yahoo.co.inWebsite:http://www.amritapuri.org
2762032,sampurnanda govt.sarvodaya girls sr,SAROJ MATHELA,Senior Secondary, 31/03/2018 ,"sec school c-block yamuna vihar delhi,110053","011,22913585",1104018pilot12@gmail.com
2730283,SANATAN DHARAM PUBLIC SCHOOL,ANITA SHARMA,Senior Secondary, 31/03/2020 ,"BU BLOCK PITAMPURA, DISTT NORTH WEST DELHI, DELHI,110034","011,27346738",anita.sdps@gmail.com
2730621,SANSKAR CONVENT SCHOOL,Yagya Rathor,Senior Secondary, 31/03/2020 ,"83, SHYAM VIHAR, E-BLOCK EXTN., NAJAFGARH,110043","011,64592800",sanskarconventschool@gmail.com
2730821,SANSKRITI MODERN SCHOOL,MRS. JYOTI PHOUGHAT,Secondary School, 31/03/2022 ,"109,Gali No.8/3, G-Block, Ratiya Marg, Sangam Vihar,110062",",01164603510",sanskritimodernschool@gmail.comWebsite:http://www.sanskritimodernschool.in
2730295,sanskriti school,ABHA SAHGAL,Senior Secondary, 31/03/2023 ,"st martin marg chanakyapuri, DISTT CENTRAL DELHI, new delhi,110021","011,26883335",principal@sanskritischool.com
2762068,sant eknath govt.sarvodaya girls sr,RAJESHWARI,Senior Secondary, 31/03/2023 ,"sec school  j & k block dilshad garden delhi,110095","011,22118830",steknath1106023@gmail.com
2730631,SANT GYANESHWAR MODEL SCHOOL,SEEMA DEVI,Senior Secondary, 31/03/2021 ,"LAKHMI ENCLAVE, EXTENED LAL DORA, ALIPUR, DELHI - 110036,110036",",011 - 65146976",sgms2010@gmail.com
2730356,sant hari dass public school,mr harender kumar,Senior Secondary, 31/03/2021 ,"opp air fce station bani camp najafgarh, DISTT SOUTH WEST DELHI, delhi,110043",",",
2730488,SANT KIRPAL MODEL SCHOOL,GULSHAN BHARDWAJ,Senior Secondary, 31/03/2020 ,"DHICHAON KALAN ROAD NAJAFGARH, DISTT SOUTH WEST DELHI, NEW DELHI,110043","011,64670903",gulshanskms@gmail.com
2730706,Sant nirankari  public school avtar enclave,MEENAKSHI CHUGH,Secondary School, 31/03/2021 ,"avtar enclave pachim vihar new delhi-110063,110063","011,42311555",meenakshi.chughsnps@gmail.com
2770001,SANT NIRANKARI BOYS SR SEC SCHOOL,S K BEDI,Senior Secondary, 31/03/2025 ,"SANT NIRANKARI COLONY DELHI,110009","011,27112754",cstb@sanchernet.in
2780001,SANT NIRANKARI GIRLS SR SEC SCHOOL,MRS PROMILA SHARMA,Senior Secondary, 31/03/2025 ,"SANT NIRANKARI COLONY DELHI,110009","011,27241143",
2730754,Sant Nirankari Public School,LEENA KAPOOR,Secondary School, 31/03/2020 ,"20B Block Tilak Nagar,110018","011,25994334",santnirankari.tilaknagar@yahoo.com
2730299,SANT NIRANKARI PUBLIC SCHOOL,Poonam Syal,Senior Secondary, 26/07/2017 ,"NIRANKARI COLONY DELHI,110009","011,65415533",poonamsyal@yahoo.com
2778020,SANT NIRANKARI SR SEC SCHOOL,SEEMA KOCHHAR,Senior Secondary, 31/03/2024 ,"PAHARGANJ NEW DELHI,110055","011,23678009",seemakochhar45@gmail.com
2730399,SANT SUJAN SINGH JI INT SCHOOL,DR R KOHLI,Senior Secondary, 31/03/2020 ,"KUSHAK NO 2 BEHIND SAROOP NAGAR, DISTT NORTH WEST DELHI, DELHI,110036","011,27731595",sssjis.school@gmail.com
2730344,SARASWATI BAL MANDIR,MAMTA CHAUHAN,Senior Secondary, 31/03/2021 ,"A-2 PASCHIM VIHAR, DISTT WEST DELHI, NEW DELHI,110063","011,25268801",mamtachauhan.sbm@gmail.com
2730053,SARASWATI BAL MANDIR,SUNITA GAUR,Secondary School, 31/03/2020 ,"JHANDEWALAN OPP NAAZ CINEMA NEW DELHI,110055","011,23523063",sbm_jw@yahoo.co.in
2730127,SARASWATI BAL MANDIR SCHOOL,REENA VERMA,Secondary School, 31/03/2020 ,"J-8 RAJOURI GARDEN EXTN NEW DELHI,110027","011,25458225",reenavarma64@gmail.com
2730312,SARASWATI BAL MANDIR SR SEC SCHOOL,MS MANJEET KAUR,Senior Secondary, 31/03/2020 ,"WARD NO 6 MEHRAULI NEW DELHI,110030","0231,26645770",
2730810,SARASWATI MODEL SCHOOL,MR. SANJAY JAIN,Secondary School, 31/03/2022 ,"GALI NO. - 5, EAST SAGARPUR, NEW DELHI - 110046,110046",",01128520134,9811697650",saraswati.sp46@gmail.com
2730537,SARASWATI PUBLIC SCHOOL,mrs sunita vimal,Secondary School, 31/03/2020 ,"280, 20 FEET ROAD BUDH VIHAR, MANDOLI,110093","0171,65092257",
2730332,SARASWATI VIDYALAYA FOR GIRLS,SHASHI BIDAWAT GARG,Senior Secondary, 31/03/2023 ,"SARASWATI BHAWAN 17 ANSARI ROAD DARYA GANJ, DISTT CENTRAL DELHI, NEW DELHI,110002","011,23269375",principal.saraswatividyalay@gmail.com
2778005,SARDAR AMAR SINGH SHER-I-PUNJAB,Ram Murit,Senior Secondary, 31/03/2025 ,"(PINDI GHEB) KHALSA SR SEC SCHOOL KAROL BAGH NEW DELHI,110005","011,23619923",1208135as@gmail.com
2754083,SARDAR BALABH BHAI PATEL,KHAN BAHADUR,Senior Secondary, 31/03/2021 ,"GOVT.SARVODAYA BOYS SR SEC SCHOOL TUGHLAKABAD EXTN. NEW DELHI,110019","011,29984543",SVBPSBV1925007@GMAIL.COM
2730176,SARDAR PATEL PUBLIC SR SEC SCHOOL,Mohd Zahid Khan,Senior Secondary, 31/03/2022 ,"KARAWAL NAGAR, DISTT EAST DELHI, DELHI,110094","011,22933077",sardarpatelschool@rediffmail.comWebsite:http://www.auroville.org.in
2730771,"SARDAR PATEL VIDYA NIKETAN,",MRS.  SANGEETA SHARMA,Senior Secondary, 31/03/2022 ,"KHASRA NO.208, MANDI VILLAGE, MANDI, NEW DELHI-110047,110047","011,011-65022784,",rajivspv@gmail.comWebsite:http://www.spvndelhi.com
2730024,SARDAR PATEL VIDYALAYA,Anuradha Joshi,Senior Secondary, 31/03/2019 ,"ROAD NO 3 LODI ESTATE NEW DELHI,110003","011,24627344",principalspv@gmail.comWebsite:http://www.spvdelhi.org
2756176,SARDAR VALLABHBHAI PATEL,VEENA BHARDWAJ,Senior Secondary, 31/03/2021 ,"CANTONMENT BOARD SR. SEC. SCHOOL, SADAR BAZAR DELHI CANTT-110010,110010","011,25694992",BHARDWAJASHWINI9@GMAIL.COM
2762031,SAROJINI NAIDU GOVT.SARVODAYA GIRLS,SMT.CHITRA LAL,Senior Secondary, 31/03/2023 ,"S.S.S.GOKAL PURI DELHI,110094",",22171019",
2756028,SARVDAYA BAL VIDYALAYA,PHOOL SINGH,Senior Secondary, 31/03/2025 ,"UTTAM NAGAR NEW  DELHI,110059","011,25352512",1618008sbvun@gmail.com
2750040,sarvodaya bal vidyalaya,RAMESH CHANDER GOEL,Secondary School, 31/03/2020 ,"tulsi nagar delhi,110035","011,23125194",gbsstulsinagar@gmail.com
2750033,SARVODAYA BAL VIDYALAYA,SH V.D.CHUGH,Senior Secondary, 31/03/2021 ,"ANANDVAS (LOK VIHAR) DELHI,110034",",27354488",
2750011,sarvodaya bal vidyalaya,SUSHIL KUMAR,Senior Secondary, 31/03/2018 ,"narela delhi,110040","011,27785442",sushilkumar.chauhan@yahoo.in
2750096,Sarvodaya Bal Vidyalaya,NAVEEN YADAV,Senior Secondary, 31/03/2022 ,"BT- Block, Shalimar Bagh, Delhi- 110 088,110088","011,27479597",svbt1309005@gmail.com
2750092,SARVODAYA BAL VIDYALAYA,HARI RAM SHARMA,Senior Secondary, 31/03/2022 ,"H BLOCK SULTAN PURI DELHI,110041","011,25483312",hrsharma1967@gmail.com
2750093,SARVODAYA BAL VIDYALAYA,HARI RAM SHARMA,Senior Secondary, 31/03/2020 ,"'R' BLOCK  MANGOL PURI DELHI,110083","011,27917066",hrsharma1967@gmail.com
2750066,sarvodaya bal vidyalaya,SHRUTI BODH AGARWAL,Senior Secondary, 31/03/2024 ,"a-block jahangir puri delhi,110033","011,27633217",sbvablk@gmail.com
2754040,sarvodaya bal vidyalaya,KULDEEP KUMAR,Senior Secondary, 31/03/2022 ,"fatehpur beri new delhi,110074","011,26654815",
2752147,sarvodaya bal vidyalaya,CHAND BABU,Senior Secondary, 31/03/2020 ,"buland masjid, shashtri park, delhi-110053,181202","011,22181999",bchand2k10@gmail.com
2752146,sarvodaya bal vidyalaya,BIR SINGH,Senior Secondary, 31/03/2020 ,"j. j. colony, khichripur village, delhi-110091,110092","011,22772054",sbvjjckhp@yahoo.com
2754130,sarvodaya bal vidyalaya,KAMLESH KUMAR MEENA,Secondary School, 31/03/2022 ,"j-block, sangam vihar,new delhi-110080,110080","011,26043056",gbssjblocksangamvihar@yahoo.com
2752139,sarvodaya bal vidyalaya,JAGDISH,Secondary School, 31/03/2017 ,"anand vihar, delhi-10092,110092","011,22144732",SBVANANDVIHAR@GMAIL.COM
2750168,sarvodaya bal vidyalaya,SUBHASH CHANDER,Senior Secondary, 31/03/2018 ,"sawada,(ghevra) colony b block, delhi,110081","011,9968680426",subhash71chander@gmail.com
2756041,SARVODAYA BAL VIDYALAYA,MUSHTAQUE ALI,Senior Secondary, 31/03/2023 ,"CHAND NAGAR NEW DELHI,110018","011,25984396",sbv1514110@gmail.com
2754007,sarvodaya bal vidyalaya,mr.  dr mohd zahid ali,Senior Secondary, 31/03/2018 ,"molarband p.o. badarpur new delhi,110044","011,26666426",gbsss1_md@rediffmail.com
2754008,SARVODAYA BAL VIDYALAYA,NIRANJAN LAL SHARMA,Senior Secondary, 31/03/2022 ,"RAILWAY COLONY TUGLAKABAD NEW DELHI,110044","011,26361734",gbsssrlycltkd@yahoo.co.in
2754026,sarvodaya bal vidyalaya,BRIJMOHAN PANCHAL,Senior Secondary, 31/03/2018 ,"sadiq nagar new delhi,110049","011,26252091",sbvsn2013@gmail.com
2758048,SARVODAYA BAL VIDYALAYA,HOTI LAL GAUHANIA,Senior Secondary, 31/03/2023 ,"KAMDHENU PLOT II MANGOLPURI DELHI,110083","011,27922691",GB_KAMDHENU@YAHOO.CO.IN
2758035,sarvodaya bal vidyalaya,KRISHANPAL,Senior Secondary, 31/03/2015 ,"roshanara road delhi,110007","011,23821720",gbsssroshnararoad1207015@gmail.com
2756092,SARVODAYA BAL VIDYALAYA,MAHIPAL SINGH,Senior Secondary, 31/03/2020 ,"BLOCK-A VIKAS PURI NEW DELHI,110018","011,25611463",sbv.vikaspuri@gmail.com
2756180,sarvodaya bal vidyalaya,PRAKASH CHANDER SHARMA,Senior Secondary, 31/03/2020 ,"ranhaula, nangloi, delhi,110041","011,28364688",pcsharma1958@yahoo.co.in
2756181,sarvodaya bal vidyalaya, MADAN LAL GANGWAR,Senior Secondary, 31/03/2020 ,"janta flat, hastsal, new delhi-110059,110018","011,25358969",MLGANGWAR4@GMAIL.IN
2752144,sarvodaya bal vidyalaya,SH. OM PRAKSH NIMRA,Senior Secondary, 31/03/2020 ,"old seelampur, delhi-110031,110031","011,7503712665",arvindkumarsre@gmail.com
2754136,sarvodaya bal vidyalaya,LAKHAN LAL MEENA,Senior Secondary, 31/03/2024 ,"jonapur, new delhi,110047","011,26658103",sbvjonapur@gmail.com
2750172,sarvodaya bal vidyalaya,SATYAVEER SINGH,Senior Secondary, 31/03/2022 ,"tikri khurd, delhi,110040","011,27781375",sbv1310458@gmail.com
2750174,sarvodaya bal vidyalaya,.,Secondary School, 31/03/2019 ,"lalita block, shastri nagar, delhi-110052,",",",
2750143,SARVODAYA BAL VIDYALAYA,JASWANT SINGH,Senior Secondary, 31/03/2021 ,"A-BLOCK, SULTANPURI, DELHI,110041","011,25483618",gsbvasultanpuri1412087@gmail.com
2756171,sarvodaya bal vidyalaya,JAGESH SINGH TYAGI,Senior Secondary, 31/03/2018 ,"nilothi,110041","011,28364011",jagesh_taygi@yahoo.com
2750151,SARVODAYA BAL VIDYALAYA,NARESH DRAVERIYA,Senior Secondary, 31/03/2018 ,"SECTOR-2O, ROHINI EXTN. (POOTH KALAN), DELHI-110086,110086","011,27581399",naresh_13_27_rohini@yahoo.co.in
2754084,SARVODAYA BAL VIDYALAYA,RAJINDER KUMAR,Senior Secondary, 31/03/2024 ,"TUGHLAKABAD EXTN NEW DELHI,110019","011,29991541",sbv.tkd19@gmail.com
2756004,SARVODAYA BAL VIDYALAYA NO 2,RAVINDRA NATH JHA,Senior Secondary, 31/03/2022 ,"PALAM ENCLAVE NEW DELHI,110045","011,25030892",sbvno2@gmail.com
2756060,SARVODAYA BAL VIDYALAYA NO I,UMESH DATT OJHA,Senior Secondary, 31/03/2018 ,"MADIPUR NEW DELHI,110063","011,25214971",umeshdattojha@gmail.com
2752145,sarvodaya bal vidyalaya no-2,LAKHAN LAL,Senior Secondary, 31/03/2020 ,"mandawali,,110092","011,22476906",lakhan11159@gmail.com
2764096,sarvodaya bal vidyalaya no. 2,RAJA RAM SINGH ,Senior Secondary, 31/03/2020 ,"sect -iv, dr. ambedkar nagar nd 110062,","011,29965851",rrsingh49@gmail.com
2756003,SARVODAYA BAL VIDYALAYA NO.1,JAG RAM MEENA,Senior Secondary, 31/03/2018 ,"palam village new delhi,110045","011,25367278",JAGRAMMEENA53@GMAIL.COM
